{
  "schemaVersion": 1,
  "provider": "LEVO2_RESEARCH",
  "finalStatus": "BLOCKED_NO_WEIGHTS",
  "checkedAt": "2026-09-06",
  "readiness": {
    "authoritativeWeightsAvailable": false,
    "licenseVerified": false,
    "productionRoutingEnabled": false
  },
  "evidence": [
    "no authoritative public LeVo2 checkpoint and research-use license were identified in the reviewed project materials",
    "no production route, worker, or substitute checkpoint was created"
  ],
  "reason": "Research readiness requires authoritative weights and terms that permit this use; neither is currently verifiable."
}