{
  "schemaVersion": 1,
  "provider": "MUQ_MULAN",
  "finalStatus": "BLOCKED_LICENSE",
  "checkedAt": "2026-09-06",
  "evidence": [
    "Source: https://github.com/tencent-ailab/MuQ/tree/28847ea50cd31ac4b8b6a7dacc051ad7d1c7606a (MIT).",
    "Official MuQ-MuLan weight snapshot: https://huggingface.co/OpenMuQ/MuQ-MuLan-large/tree/2e01c796b71dca71b45251384c04cd7b237c9020 (CC-BY-NC-4.0)."
  ],
  "reason": "The required multimodal embedding weights are explicitly non-commercial and no accepted research-only deployment boundary exists.",
  "blockers": [
    "Do not expose a commercial production text-to-music similarity endpoint using CC-BY-NC-4.0 weights.",
    "No immutable local weight inventory or real related-versus-unrelated audio smoke exists."
  ]
}